{"membership":{"1905e8d1589139911168d5467e2ad7c6db32d1f80dfef2dc2a04b33848dfcf1a":{"entries":["1905e8d1589139911168d5467e2ad7c6db32d1f80dfef2dc2a04b33848dfcf1a","bcbfad3bbc193844c5b667c738d33dda7f2009b5a494ced3bfe8d7f532cfbb54"],"path":[]},"bcbfad3bbc193844c5b667c738d33dda7f2009b5a494ced3bfe8d7f532cfbb54":{"entries":["1905e8d1589139911168d5467e2ad7c6db32d1f80dfef2dc2a04b33848dfcf1a","bcbfad3bbc193844c5b667c738d33dda7f2009b5a494ced3bfe8d7f532cfbb54"],"path":[]}},"objects":{"1905e8d1589139911168d5467e2ad7c6db32d1f80dfef2dc2a04b33848dfcf1a":{"dependencies":["bcbfad3bbc193844c5b667c738d33dda7f2009b5a494ced3bfe8d7f532cfbb54"],"interface":{"conditions":[],"effects":[],"operations":["apply","until.from"],"parameters":{"count":{"Value":"U32"},"embed":{"Arrow":[{"Value":{"Named":"Reduced"}},{"Value":{"Named":"State"}}]},"index":{"Value":"U32"},"reduced_step":{"Arrow":[{"Value":"U32"},{"Arrow":[{"Value":{"Named":"Reduced"}},{"Value":{"Named":"Reduced"}}]}]},"reduced_stop":{"Arrow":[{"Value":{"Named":"Reduced"}},{"Value":"Bool"}]},"state":{"Value":{"Named":"Reduced"}},"step":{"Arrow":[{"Value":"U32"},{"Arrow":[{"Value":{"Named":"State"}},{"Value":{"Named":"State"}}]}]},"stop":{"Arrow":[{"Value":{"Named":"State"}},{"Value":"Bool"}]}},"result":{"Value":{"Named":"State"}}},"kind":"rewrite","payload":{"assumptions":[{"from":{"node":{"Op":["apply",[{"node":{"Op":["apply",[{"node":{"Free":"step"},"sort":{"Arrow":[{"Value":"U32"},{"Arrow":[{"Value":{"Named":"State"}},{"Value":{"Named":"State"}}]}]}},{"node":{"Free":"item"},"sort":{"Value":"U32"}}]]},"sort":{"Arrow":[{"Value":{"Named":"State"}},{"Value":{"Named":"State"}}]}},{"node":{"Op":["apply",[{"node":{"Free":"embed"},"sort":{"Arrow":[{"Value":{"Named":"Reduced"}},{"Value":{"Named":"State"}}]}},{"node":{"Free":"current"},"sort":{"Value":{"Named":"Reduced"}}}]]},"sort":{"Value":{"Named":"State"}}}]]},"sort":{"Value":{"Named":"State"}}},"name":"transition","params":{"current":{"Value":{"Named":"Reduced"}},"item":{"Value":"U32"}},"to":{"node":{"Op":["apply",[{"node":{"Free":"embed"},"sort":{"Arrow":[{"Value":{"Named":"Reduced"}},{"Value":{"Named":"State"}}]}},{"node":{"Op":["apply",[{"node":{"Op":["apply",[{"node":{"Free":"reduced_step"},"sort":{"Arrow":[{"Value":"U32"},{"Arrow":[{"Value":{"Named":"Reduced"}},{"Value":{"Named":"Reduced"}}]}]}},{"node":{"Free":"item"},"sort":{"Value":"U32"}}]]},"sort":{"Arrow":[{"Value":{"Named":"Reduced"}},{"Value":{"Named":"Reduced"}}]}},{"node":{"Free":"current"},"sort":{"Value":{"Named":"Reduced"}}}]]},"sort":{"Value":{"Named":"Reduced"}}}]]},"sort":{"Value":{"Named":"State"}}}},{"from":{"node":{"Op":["apply",[{"node":{"Free":"stop"},"sort":{"Arrow":[{"Value":{"Named":"State"}},{"Value":"Bool"}]}},{"node":{"Op":["apply",[{"node":{"Free":"embed"},"sort":{"Arrow":[{"Value":{"Named":"Reduced"}},{"Value":{"Named":"State"}}]}},{"node":{"Free":"current"},"sort":{"Value":{"Named":"Reduced"}}}]]},"sort":{"Value":{"Named":"State"}}}]]},"sort":{"Value":"Bool"}},"name":"stopping","params":{"current":{"Value":{"Named":"Reduced"}}},"to":{"node":{"Op":["apply",[{"node":{"Free":"reduced_stop"},"sort":{"Arrow":[{"Value":{"Named":"Reduced"}},{"Value":"Bool"}]}},{"node":{"Free":"current"},"sort":{"Value":{"Named":"Reduced"}}}]]},"sort":{"Value":"Bool"}}}],"conditions":[],"from":{"node":{"Op":["until.from",[{"node":{"Free":"count"},"sort":{"Value":"U32"}},{"node":{"Free":"index"},"sort":{"Value":"U32"}},{"node":{"Op":["apply",[{"node":{"Free":"embed"},"sort":{"Arrow":[{"Value":{"Named":"Reduced"}},{"Value":{"Named":"State"}}]}},{"node":{"Free":"state"},"sort":{"Value":{"Named":"Reduced"}}}]]},"sort":{"Value":{"Named":"State"}}},{"node":{"Free":"stop"},"sort":{"Arrow":[{"Value":{"Named":"State"}},{"Value":"Bool"}]}},{"node":{"Free":"step"},"sort":{"Arrow":[{"Value":"U32"},{"Arrow":[{"Value":{"Named":"State"}},{"Value":{"Named":"State"}}]}]}}]]},"sort":{"Value":{"Named":"State"}}},"params":{"count":{"Value":"U32"},"embed":{"Arrow":[{"Value":{"Named":"Reduced"}},{"Value":{"Named":"State"}}]},"index":{"Value":"U32"},"reduced_step":{"Arrow":[{"Value":"U32"},{"Arrow":[{"Value":{"Named":"Reduced"}},{"Value":{"Named":"Reduced"}}]}]},"reduced_stop":{"Arrow":[{"Value":{"Named":"Reduced"}},{"Value":"Bool"}]},"state":{"Value":{"Named":"Reduced"}},"step":{"Arrow":[{"Value":"U32"},{"Arrow":[{"Value":{"Named":"State"}},{"Value":{"Named":"State"}}]}]},"stop":{"Arrow":[{"Value":{"Named":"State"}},{"Value":"Bool"}]}},"proof":{"Sym":{"Use":{"arguments":{"count":{"node":{"Free":"count"},"sort":{"Value":"U32"}},"index":{"node":{"Free":"index"},"sort":{"Value":"U32"}},"project":{"node":{"Free":"embed"},"sort":{"Arrow":[{"Value":{"Named":"Reduced"}},{"Value":{"Named":"State"}}]}},"reduced":{"node":{"Free":"step"},"sort":{"Arrow":[{"Value":"U32"},{"Arrow":[{"Value":{"Named":"State"}},{"Value":{"Named":"State"}}]}]}},"reduced_stop":{"node":{"Free":"stop"},"sort":{"Arrow":[{"Value":{"Named":"State"}},{"Value":"Bool"}]}},"state":{"node":{"Free":"state"},"sort":{"Value":{"Named":"Reduced"}}},"step":{"node":{"Free":"reduced_step"},"sort":{"Arrow":[{"Value":"U32"},{"Arrow":[{"Value":{"Named":"Reduced"}},{"Value":{"Named":"Reduced"}}]}]}},"stop":{"node":{"Free":"reduced_stop"},"sort":{"Arrow":[{"Value":{"Named":"Reduced"}},{"Value":"Bool"}]}}},"assumptions":[{"Sym":{"Assume":{"arguments":{"current":{"node":{"Free":"__assumed_current"},"sort":{"Value":{"Named":"Reduced"}}},"item":{"node":{"Free":"__assumed_item"},"sort":{"Value":"U32"}}},"index":0}}},{"Sym":{"Assume":{"arguments":{"current":{"node":{"Free":"__assumed_current"},"sort":{"Value":{"Named":"Reduced"}}}},"index":1}}}],"law":"bcbfad3bbc193844c5b667c738d33dda7f2009b5a494ced3bfe8d7f532cfbb54","premises":[],"types":{"State":{"Named":"Reduced"},"View":{"Named":"State"}}}}},"to":{"node":{"Op":["apply",[{"node":{"Free":"embed"},"sort":{"Arrow":[{"Value":{"Named":"Reduced"}},{"Value":{"Named":"State"}}]}},{"node":{"Op":["until.from",[{"node":{"Free":"count"},"sort":{"Value":"U32"}},{"node":{"Free":"index"},"sort":{"Value":"U32"}},{"node":{"Free":"state"},"sort":{"Value":{"Named":"Reduced"}}},{"node":{"Free":"reduced_stop"},"sort":{"Arrow":[{"Value":{"Named":"Reduced"}},{"Value":"Bool"}]}},{"node":{"Free":"reduced_step"},"sort":{"Arrow":[{"Value":"U32"},{"Arrow":[{"Value":{"Named":"Reduced"}},{"Value":{"Named":"Reduced"}}]}]}}]]},"sort":{"Value":{"Named":"Reduced"}}}]]},"sort":{"Value":{"Named":"State"}}},"types":["State","Reduced"]},"schema":1,"semantics":"ink-general-laws-v1"},"bcbfad3bbc193844c5b667c738d33dda7f2009b5a494ced3bfe8d7f532cfbb54":{"dependencies":[],"interface":{"conditions":[],"effects":[],"operations":["apply","binary:+","binary:-","binary:==","call:choose","until.from"],"parameters":{"count":{"Value":"U32"},"index":{"Value":"U32"},"project":{"Arrow":[{"Value":{"Named":"State"}},{"Value":{"Named":"View"}}]},"reduced":{"Arrow":[{"Value":"U32"},{"Arrow":[{"Value":{"Named":"View"}},{"Value":{"Named":"View"}}]}]},"reduced_stop":{"Arrow":[{"Value":{"Named":"View"}},{"Value":"Bool"}]},"state":{"Value":{"Named":"State"}},"step":{"Arrow":[{"Value":"U32"},{"Arrow":[{"Value":{"Named":"State"}},{"Value":{"Named":"State"}}]}]},"stop":{"Arrow":[{"Value":{"Named":"State"}},{"Value":"Bool"}]}},"result":{"Value":{"Named":"View"}}},"kind":"rewrite","payload":{"assumptions":[{"from":{"node":{"Op":["apply",[{"node":{"Free":"project"},"sort":{"Arrow":[{"Value":{"Named":"State"}},{"Value":{"Named":"View"}}]}},{"node":{"Op":["apply",[{"node":{"Op":["apply",[{"node":{"Free":"step"},"sort":{"Arrow":[{"Value":"U32"},{"Arrow":[{"Value":{"Named":"State"}},{"Value":{"Named":"State"}}]}]}},{"node":{"Free":"item"},"sort":{"Value":"U32"}}]]},"sort":{"Arrow":[{"Value":{"Named":"State"}},{"Value":{"Named":"State"}}]}},{"node":{"Free":"current"},"sort":{"Value":{"Named":"State"}}}]]},"sort":{"Value":{"Named":"State"}}}]]},"sort":{"Value":{"Named":"View"}}},"name":"simulation","params":{"current":{"Value":{"Named":"State"}},"item":{"Value":"U32"}},"to":{"node":{"Op":["apply",[{"node":{"Op":["apply",[{"node":{"Free":"reduced"},"sort":{"Arrow":[{"Value":"U32"},{"Arrow":[{"Value":{"Named":"View"}},{"Value":{"Named":"View"}}]}]}},{"node":{"Free":"item"},"sort":{"Value":"U32"}}]]},"sort":{"Arrow":[{"Value":{"Named":"View"}},{"Value":{"Named":"View"}}]}},{"node":{"Op":["apply",[{"node":{"Free":"project"},"sort":{"Arrow":[{"Value":{"Named":"State"}},{"Value":{"Named":"View"}}]}},{"node":{"Free":"current"},"sort":{"Value":{"Named":"State"}}}]]},"sort":{"Value":{"Named":"View"}}}]]},"sort":{"Value":{"Named":"View"}}}},{"from":{"node":{"Op":["apply",[{"node":{"Free":"stop"},"sort":{"Arrow":[{"Value":{"Named":"State"}},{"Value":"Bool"}]}},{"node":{"Free":"current"},"sort":{"Value":{"Named":"State"}}}]]},"sort":{"Value":"Bool"}},"name":"stopping","params":{"current":{"Value":{"Named":"State"}}},"to":{"node":{"Op":["apply",[{"node":{"Free":"reduced_stop"},"sort":{"Arrow":[{"Value":{"Named":"View"}},{"Value":"Bool"}]}},{"node":{"Op":["apply",[{"node":{"Free":"project"},"sort":{"Arrow":[{"Value":{"Named":"State"}},{"Value":{"Named":"View"}}]}},{"node":{"Free":"current"},"sort":{"Value":{"Named":"State"}}}]]},"sort":{"Value":{"Named":"View"}}}]]},"sort":{"Value":"Bool"}}}],"conditions":[],"from":{"node":{"Op":["apply",[{"node":{"Free":"project"},"sort":{"Arrow":[{"Value":{"Named":"State"}},{"Value":{"Named":"View"}}]}},{"node":{"Op":["until.from",[{"node":{"Free":"count"},"sort":{"Value":"U32"}},{"node":{"Free":"index"},"sort":{"Value":"U32"}},{"node":{"Free":"state"},"sort":{"Value":{"Named":"State"}}},{"node":{"Free":"stop"},"sort":{"Arrow":[{"Value":{"Named":"State"}},{"Value":"Bool"}]}},{"node":{"Free":"step"},"sort":{"Arrow":[{"Value":"U32"},{"Arrow":[{"Value":{"Named":"State"}},{"Value":{"Named":"State"}}]}]}}]]},"sort":{"Value":{"Named":"State"}}}]]},"sort":{"Value":{"Named":"View"}}},"params":{"count":{"Value":"U32"},"index":{"Value":"U32"},"project":{"Arrow":[{"Value":{"Named":"State"}},{"Value":{"Named":"View"}}]},"reduced":{"Arrow":[{"Value":"U32"},{"Arrow":[{"